id,desc,lat,lng,modes,extra,equiv
BRPN:HENI,Henrys Fork near Lake ID,44.595,-111.35,Q=QD=0;GH=GJ=1,,,,796.0986;Rb29df3baecf6ec41, O2 L5 Drainage:28km2 AvgFlow:1cfs AvgPrecip:744mm AvgTemp:2C
BRPN:HFAI,Henrys Fork near Ashton ID,44.0697,-111.5106,Q=QD=0;GH=GJ=1,,,,425.0989;R7d3f81a488d9e941,Henrys Fork O6 L3 Drainage:2849km2 AvgFlow:1759cfs AvgPrecip:412mm AvgTemp:5C
BRPN:HGH,Hungry Horse Reservoir near Hungry Horse MT,48.3411,-114.0133,Q=QD=0;GH=GJ=1,,,,900.6682;Rac1c5addc7ef9e41,South Fork Flathead River O5 L3 Drainage:4289km2 AvgFlow:3490cfs AvgPrecip:872mm AvgTemp:4C
BRPN:HGHM,S.Fk. Flathead Riv nr Columbia Falls at Hungry Horse,48.3567,-114.0367,Q=QD=0;GH=GJ=1;WF=WF=2;WC=WC=3,,,,901.3784;R23dbb9799008e241,South Fork Flathead River O5 L3 Drainage:4331km2 AvgFlow:3565cfs AvgPrecip:840mm AvgTemp:5C
BRPN:HPCO,Howard Prairie Delivery Canal & Keene Creek Dam OR,42.1289,-122.4772,Q=QD=0;QC=QJ=0;CH=CJ=1;WF=WF=2,,,,435.3822;R426091660623ee41,Keene Creek O2 L3 Drainage:52km2 AvgFlow:29cfs AvgPrecip:879mm AvgTemp:8C
BRPN:HPD,Howard Prairie Lake and Dam near Ashland OR,42.2167,-122.3761,Q=QD=0;QC=QJ=0;CH=CJ=1;WF=WF=2,,,,889.622;R4260a53a1428aa41, O1 L2 Drainage:59km2 AvgFlow:32cfs AvgPrecip:889mm AvgTemp:7C
BRPN:HRSI,Payette River near Horseshoe Bend ID,43.945,-116.1969,Q=QD=0;GH=GJ=1;WF=WF=2,,,,355.5852;R068161dde45be041,Payette River O6 L4 Drainage:5696km2 AvgFlow:3361cfs AvgPrecip:481mm AvgTemp:10C
BRPN:HYA,Hyatt Dam and Reservoir near Ashland OR,42.1722,-122.4667,Q=QD=0;GH=GJ=1;WF=WF=2,,,,134.423;R8d970aa4a105e441,Keene Creek O1 L3 Drainage:32km2 AvgFlow:19cfs AvgPrecip:902mm AvgTemp:7C
BRPN:IDCI,IDAHO CANAL NR LEWISVILLE,43.6139,-112.0528,QC=QJ=0;CH=CJ=1,,,,970.4044;R295c8f01a7d09541,Snake River O7 L2 Drainage:23339km2 AvgFlow:5538cfs AvgPrecip:300mm AvgTemp:6C
BRPN:INCI,INDEPENDENT CANAL,43.9589,-111.7011,QC=QJ=0;CH=CJ=1,,,,47.9894;R8d978699a479dc41,Independent Canal 
BRPN:ISCI,ISLAND CANAL,43.6917,-111.8542,QC=QJ=0;CH=CJ=1,,,,862.1485;Re9266d3d16e9e641, 
BRPN:ISL,Island Park Dam and Reservoir ID,44.4197,-111.4139,Q=QD=0,,,,352.9364;R3108547f9b57d841,Henrys Fork O6 L3 Drainage:1288km2 AvgFlow:702cfs AvgPrecip:741mm AvgTemp:3C
BRPN:ISLI,Henrys Fork near Island Park ID,44.4164,-111.3947,Q=QD=0;GH=GJ=1;WF=WF=2,,,,804.3961;Rdbf94e9c834ae041,Henrys Fork O6 L3 Drainage:1407km2 AvgFlow:761cfs AvgPrecip:725mm AvgTemp:3C
BRPN:JCCO,Jackson Creek at Central Point,42.4128,-122.9422,Q=QD=0;GH=GJ=1;WF=WF=2,,,,666.9824;R333373e6b64be441,Jackson Creek O3 L3 Drainage:56km2 AvgFlow:12cfs AvgPrecip:491mm AvgTemp:12C
BRPN:JCJO,Jackson Cr at Jacksonville,42.3209,-122.9586,Q=QD=0;GH=GJ=1;WF=WF=2,,,,525.6282;R000080324265a241,Jackson Creek O3 L3 Drainage:26km2 AvgFlow:7cfs AvgPrecip:518mm AvgTemp:12C
BRPN:JCK,Jackson Lake at Dam on Snake River near Moran WY,43.8592,-110.5897,Q=QD=0;GH=GJ=1;WF=WF=2,,,,979.4346;Rc1ca31982515e141,Pilgrim Creek O3 L3 Drainage:126km2 AvgFlow:84cfs AvgPrecip:618mm AvgTemp:3C
BRPN:JCTO,Joint System Canal bel Junction nr Lakecreek,42.4218,-122.6225,QC=QJ=0;CH=CJ=1,,,,634.9381;R1b2f9d5806f3df41,North Fork Little Butte Creek O3 L3 Drainage:146km2 AvgFlow:68cfs AvgPrecip:636mm AvgTemp:11C
BRPN:JDA,JOHN DAY DAM & LAKE UMATILLA ON COLUMBIA R,45.72,-120.7,Q=QD=0,,,,759.8981;R7368c9999adcde41,Columbia River O9 L1 Drainage:542844km2 AvgFlow:182972cfs AvgPrecip:315mm AvgTemp:11C
BRPN:JDIO,South Fork John Day River above Izee Falls,44.1236,-119.4906,Q=QD=0;GH=GJ=1;WF=WF=2,,,,965.253;R986e928da548ec41,South Fork John Day River O4 L3 Drainage:536km2 AvgFlow:49cfs AvgPrecip:414mm AvgTemp:7C
BRPN:JDMO,John Day River at McDonald Ferry OR,45.5878,-120.4083,Q=QD=0;GH=GJ=1,,,,854.6359;Ree7cff2f4ed4d841,John Day River O6 L2 Drainage:19784km2 AvgFlow:2302cfs AvgPrecip:248mm AvgTemp:11C
BRPN:JKSY,Snake River below Flat Creek near Jackson WY,43.3722,-110.7386,Q=QD=0;GH=GJ=1,,,,805.1673;R3d0ae7998e10d941,Snake River O6 L2 Drainage:6930km2 AvgFlow:3738cfs AvgPrecip:471mm AvgTemp:4C
BRPN:JRPI,J. Ricks Pipeline (Teton River),43.8514,-111.2533,QC=QJ=0,,,,7.962;R68918d654c0cc841,Teton River O5 L4 Drainage:1189km2 AvgFlow:555cfs AvgPrecip:451mm AvgTemp:4C
BRPN:KAC,KACHESS RESERVOIR RIVER AND WEATHER STATION,47.2647,-121.2044,Q=QD=0;GH=GJ=1,,,,316.0981;R9eef67d87e9aaa41,Kachess River O4 L4 Drainage:168km2 AvgFlow:331cfs AvgPrecip:1322mm AvgTemp:7C
BRPN:KEE,KEECHELUS RESERVOIR-YAK AT MARTIN AND WEATHER STA.,47.3222,-121.3389,Q=QD=0;GH=GJ=1,,,,797.947;R46b60319c553cd41,Price Creek O1 L5 Drainage:2km2 AvgFlow:3cfs AvgPrecip:2197mm AvgTemp:6C
BRPN:KERM,POLSON KERR DAM,47.68,-114.23,Q=QD=0,,,,436.8155;Rcba18500058fc541,Flathead River O6 L2 Drainage:18100km2 AvgFlow:11698cfs AvgPrecip:395mm AvgTemp:7C
BRPN:KIOW,YAKIMA RIVER AT KIONA WA,46.2533,-119.4772,Q=QD=0;GH=GJ=1;WF=WF=2,,,,174.1127;R6210d065ee95ee41,Yakima River O7 L2 Drainage:14145km2 AvgFlow:3609cfs AvgPrecip:218mm AvgTemp:11C
BRPN:KNCW,KENNEWICK CANAL,46.2653,-119.5694,QC=QJ=0;CH=CJ=1,,,,866.0435;R4c37e9257155b141, 
BRPN:KTCW,KITTITAS CANAL,47.2389,-121.1833,QC=QJ=0;CH=CJ=1,,,,606.6094;R1f855389dd05dc41,Yakima River O5 L3 Drainage:470km2 AvgFlow:993cfs AvgPrecip:1272mm AvgTemp:7C
BRPN:LABI,WEST LABELLE & LONG ISLAND CANAL NR RIGBY,46.6906,-111.7639,QC=QJ=0;CH=CJ=1,,,,105.0936;R19046e09023cd041, O1 L3 Drainage:3km2 AvgFlow:0cfs AvgPrecip:330mm AvgTemp:6C
BRPN:LACI,East Labelle Weir,43.6733,-111.8042,QC=QJ=0;CH=CJ=1,,,,309.3133;Re7fb1ded9d30ee41, 
BRPN:LAPO,Little Deschutes River near LaPine OR,43.6892,-121.5017,Q=QD=0;GH=GJ=1;WF=WF=2,,,,813.893;R022b877190d7a341,Little Deschutes River O4 L3 Drainage:1928km2 AvgFlow:226cfs AvgPrecip:622mm AvgTemp:7C
BRPN:LBCO,Little Butte Creek at Lakecreek OR,42.4222,-122.6222,Q=QD=0;GH=GJ=1;WF=WF=2;WC=WC=3,,,,134.9995;R9a99b107cfdfed41,Little Butte Creek O4 L2 Drainage:510km2 AvgFlow:121cfs AvgPrecip:610mm AvgTemp:11C
BRPN:LBEO,Little Butte Creek below Eagle Point OR,42.4628,-122.8153,Q=QD=0;GH=GJ=1;WF=WF=2,,,,54.5319;R89414887934dd341,Little Butte Creek O4 L2 Drainage:760km2 AvgFlow:199cfs AvgPrecip:567mm AvgTemp:12C
BRPN:LBGO,WT-Water Turbidity-FNU,42.4766,-122.7931,GH=GJ=1;WF=WF=2;WC=WC=3;Q=QD=0,,,,913.2672;R643b97e32aabea41,Little Butte Creek O4 L2 Drainage:741km2 AvgFlow:196cfs AvgPrecip:678mm AvgTemp:12C
BRPN:LEFO,Tualatin River below Lee Falls nr Cherry Grove OR,45.5058,-123.2183,Q=QD=0;GH=GJ=1;WF=WF=2,,,,181.1918;R9cc49c39322ae441, O1 L5 Drainage:9km2 AvgFlow:9cfs AvgPrecip:1324mm AvgTemp:11C
BRPN:LNRW,LITTLE NACHES RIVER NEAR NILE WA,46.9875,-121.0986,Q=QD=0;GH=GJ=1;WF=WF=2,,,,323.9881;R583904f55f51cf41,Little Naches River O4 L5 Drainage:386km2 AvgFlow:423cfs AvgPrecip:915mm AvgTemp:7C
BRPN:LORI,Snake River at Lorenzo ID,43.7353,-111.8781,Q=QD=0;GH=GJ=1;WF=WF=2,,,,901.4731;R8b6cc778ce53db41,Snake River O6 L2 Drainage:14696km2 AvgFlow:4886cfs AvgPrecip:326mm AvgTemp:6C
BRPN:LOS,Rogue River at Lost Creek Dam (US Army Corps of Engineers),42.67,-122.68,Q=QD=0,,,,442.9836;R48e10ab09c53c141,Rogue River O5 L1 Drainage:1780km2 AvgFlow:1997cfs AvgPrecip:878mm AvgTemp:11C
BRPN:LPPI,PA LATERAL (PUMPING PLANT) NR MILNER,42.5333,-113.9667,QC=QJ=0;CH=CJ=1,,,,457.3011;R3bdf27e231a8d241, O1 L3 Drainage:1km2 AvgFlow:0cfs AvgPrecip:264mm AvgTemp:9C
BRPN:LUC,Lucky Peak Lake near Boise ID,43.5419,-116.0542,Q=QD=0,,,,902.073;R8b6ce7dbf0cc8a41, O2 L4 Drainage:13km2 AvgFlow:1cfs AvgPrecip:401mm AvgTemp:10C
BRPN:LWG,LOWER GRANITE DAM & LAKE ON SNAKE RIV,46.67,-117.43,Q=QD=0,,,,972.3063;R77beaffd2398cc41,Snake River O8 L2 Drainage:231057km2 AvgFlow:52776cfs AvgPrecip:457mm AvgTemp:12C
BRPN:LWOI,Little Wood River above High Five Creek ID,43.4931,-114.0572,Q=QD=0;GH=GJ=1,,,,997.7877;R7368254d6d26e541,Little Wood River O5 L5 Drainage:298km2 AvgFlow:66cfs AvgPrecip:369mm AvgTemp:5C
BRPN:MABO,North Fork Malheur River abv Beulah Res OR,43.9503,-118.1744,Q=QD=0;GH=GJ=1;WF=WF=2,,,,787.4264;Rfa7e2ada87dfef41,North Fork Malheur River O5 L4 Drainage:889km2 AvgFlow:137cfs AvgPrecip:299mm AvgTemp:9C
BRPN:MADO,Malheur River near Drewsey OR,43.7847,-118.3306,Q=QD=0;GH=GJ=1;WF=WF=2,,,,778.8528;R986e0a461847e941,Malheur River O5 L3 Drainage:2040km2 AvgFlow:265cfs AvgPrecip:261mm AvgTemp:8C
BRPN:MAFO,Maxwell Diversion,45.8019,-119.3556,QC=QJ=0;WF=WF=2,,,,22.3685;R8b6c0753f130e741,Maxwell Canal 
BRPN:MALO,Malheur River at 36th St. Bridge near Ontario OR,44.0403,-117.0206,Q=QD=0;GH=GJ=1;WF=WF=2,,,,4.7109;R25060d8e0e9ee841,Malheur River O6 L3 Drainage:12173km2 AvgFlow:381cfs AvgPrecip:265mm AvgTemp:10C
BRPN:MAXO,Maxwell Canal near Hermiston OR,45.8047,-119.3578,QC=QJ=0;CH=CJ=1,,,,354.9678;R8b6c0753f130e741,Maxwell Canal 
BRPN:MCFO,McKay Ck. Adult Fish Barrier,45.6681,-118.8408,GH=GJ=1;WF=WF=2,,,,498.0486;R7b14ae511a19bf41,McKay Creek O4 L3 Drainage:516km2 AvgFlow:111cfs AvgPrecip:345mm AvgTemp:11C
BRPN:MCGI,Mann Creek at Mann Creek Guard Station ID,44.5014,-116.9492,GH=GJ=1,,,,378.1413;R5839d4c61bc7b941,Mann Creek O3 L4 Drainage:75km2 AvgFlow:38cfs AvgPrecip:919mm AvgTemp:8C
BRPN:MCII,Mann Creek bel Adams Cr abv Reservoir,44.4803,-116.9325,GH=GJ=1;WF=WF=2,,,,672.6796;R448b6c4628deba41,Mann Creek O3 L4 Drainage:113km2 AvgFlow:56cfs AvgPrecip:740mm AvgTemp:8C
BRPN:MCKO,Mckay Creek near Pendleton OR,45.6094,-118.7986,Q=QD=0;GH=GJ=1;WF=WF=2,,,,501.1235;R7368314b6c69c441,McKay Creek O4 L3 Drainage:500km2 AvgFlow:104cfs AvgPrecip:372mm AvgTemp:11C
BRPN:MCN,MCNARY DAM & LAKE WALLULA ON COLUMBIA RIV,45.93,-119.3,Q=QD=0,,,,651.1654;Rdbf97e7a95e79541,Columbia River O9 L1 Drainage:509716km2 AvgFlow:179733cfs AvgPrecip:220mm AvgTemp:12C
BRPN:MDCO,McDonald Creek above McDonald Ditch,42.1015,-122.799,Q=QD=0;GH=GJ=1;WF=WF=2,,,,838.3816;R81955bdc632ee141,McDonald Creek O1 L4 Drainage:7km2 AvgFlow:6cfs AvgPrecip:1304mm AvgTemp:6C
BRPN:MDDO,McDonald Ditch at McDonald Creek,48.0894,-123.2366,QC=QJ=0;CH=CJ=1,,,,20.9904;R448b8c65587bbc41,McDonald Creek O2 L1 Drainage:58km2 AvgFlow:38cfs AvgPrecip:562mm AvgTemp:10C
BRPN:MDNI,Main Drain North near Heyburn ID,42.5506,-113.8664,Q=QD=0;GH=GJ=1,,,,686.978;R643b87b4b4dbee41,Main Drain 
BRPN:MDWO,McDonald Ditch at Wagner Gap,42.1393,-122.8028,QC=QJ=0;CH=CJ=1,,,,908.0572;Re17aaca2e30cd741, O1 L3 Drainage:5km2 AvgFlow:3cfs AvgPrecip:921mm AvgTemp:8C
BRPN:MEDW,Meadow Creek (Inflow to Keechelus),47.3141,-121.3516,Q=QD=0;GH=GJ=1,,,,13.3711;Ra01a0768150fe241,Meadow Creek O2 L4 Drainage:21km2 AvgFlow:46cfs AvgPrecip:1975mm AvgTemp:6C
BRPN:MFDO,Bear Creek at Medford OR,42.3308,-122.8717,Q=QD=0;GH=GJ=1,,,,33.1003;R986e9a1fc540e841,Bear Creek O4 L2 Drainage:748km2 AvgFlow:131cfs AvgPrecip:513mm AvgTemp:12C
BRPN:MFPI,Middle Fork Payette River at Crouch ID,44.1,-115.98,Q=QD=0;GH=GJ=1,,,,817.7431;R91edac0c1c3fce41,Middle Fork Payette River O4 L5 Drainage:878km2 AvgFlow:391cfs AvgPrecip:662mm AvgTemp:9C
BRPN:MHPI,Milner Power Plant (Idaho Power Co.),42.52,-114.03,Q=QD=0,,,,495.2937;Rae4751a2c746c541,Snake River O7 L2 Drainage:44117km2 AvgFlow:4052cfs AvgPrecip:269mm AvgTemp:9C
BRPN:MIDO,Medford ID Canal at Bradshaw Drop nr Brownsboro,42.4136,-122.6067,QC=QJ=0;CH=CJ=1,,,,976.244;R1b2f9d5806f3df41,North Fork Little Butte Creek O3 L3 Drainage:146km2 AvgFlow:68cfs AvgPrecip:636mm AvgTemp:11C
BRPN:MIII,MILNER-GOODING CANAL,42.5275,-114.0103,QC=QJ=0;CH=CJ=1,,,,781.9508;R3333b7f45506e341,Snake River O7 L2 Drainage:44011km2 AvgFlow:7589cfs AvgPrecip:266mm AvgTemp:9C
BRPN:MILI,Snake River at Milner Idaho,42.5283,-114.0183,Q=QD=0;GH=GJ=1,,,,977.4082;R46b66fa0d528ee41,Snake River O7 L2 Drainage:44012km2 AvgFlow:6040cfs AvgPrecip:266mm AvgTemp:9C
BRPN:MIN,Minidoka Dam and Lake Walcott ID,42.6708,-113.4833,GH=GJ=1;CH=CJ=1,,,,706.3773;R2db28d3eb582cd41,Snake River O7 L2 Drainage:41576km2 AvgFlow:7620cfs AvgPrecip:255mm AvgTemp:9C
BRPN:MINI,Snake River near Minidoka ID,42.6731,-113.4994,Q=QD=0;GH=GJ=1;WF=WF=2,,,,59.0029;R2db28d3eb582cd41,Snake River O7 L2 Drainage:41576km2 AvgFlow:7620cfs AvgPrecip:255mm AvgTemp:9C
BRPN:MLCI,MILNER LOW-LIFT CANAL NR MILNER,42.5194,-114.01,QC=QJ=0,,,,846.3857;R7f6ac86f5c1dea41, 
BRPN:MLCO,Mill Creek nr Prineville OR,44.4072,-120.6397,Q=QD=0;GH=GJ=1;WF=WF=2,,,,122.964;Ra470bdc00f4c9541,Mill Creek O3 L5 Drainage:120km2 AvgFlow:12cfs AvgPrecip:403mm AvgTemp:7C
BRPN:MNNI,Snake River near Menan (USGS),43.7528,-111.9792,Q=QD=0;GH=GJ=1,,,,998.1815;R2fddc4515e8fd741,Snake River O7 L2 Drainage:22565km2 AvgFlow:6057cfs AvgPrecip:308mm AvgTemp:6C
BRPN:MORI,Mores Creek above Robie Creek ID,43.6481,-115.9889,Q=QD=0;GH=GJ=1,,,,720.234;R3bdf8f08e6d7e341,Mores Creek O5 L4 Drainage:1020km2 AvgFlow:380cfs AvgPrecip:536mm AvgTemp:9C
BRPN:MPCI,MINIDOKA NO SIDE PUMP CANAL NR BURLEY,42.5336,-113.9469,QC=QJ=0,,,,414.3901;R250635e14cd5e841, O1 L3 Drainage:2km2 AvgFlow:0cfs AvgPrecip:260mm AvgTemp:9C
BRPN:MRYI,MARYSVILLE CANAL NR SQUIRREL IDAHO,44.0617,-111.3283,QC=QJ=0;CH=CJ=1,,,,910.5882;Rf6285c09f3b6c241, 
BRPN:MSEY,Snake River at Moose WY (USGS),43.654,-110.7153,Q=QD=0;GH=GJ=1,,,,24.0499;Rb81e6db4cc59ea41,Snake River O5 L2 Drainage:4360km2 AvgFlow:2985cfs AvgPrecip:611mm AvgTemp:3C
BRPN:MUCO,Murderers Creek near Mouth,44.3158,-119.5342,Q=QD=0;GH=GJ=1;WF=WF=2,,,,678.0498;R08ac3c3f14cfc741,Murderers Creek O3 L4 Drainage:337km2 AvgFlow:11cfs AvgPrecip:390mm AvgTemp:9C
BRPN:MXCI,N.S. X-CUT DIVERSION FROM GOODING,42.5586,-114.0514,QC=QJ=0;CH=CJ=1,,,,,
BRPN:MYKO,Mckay Creek near Pilot Rock OR,45.5492,-118.7733,Q=QD=0;GH=GJ=1;WF=WF=2,,,,38.5701;Ra47051f02576e341,McKay Creek O4 L3 Drainage:479km2 AvgFlow:115cfs AvgPrecip:444mm AvgTemp:10C
BRPN:NACW,NACHES RIVER NEAR NACHES WA.,46.7456,-120.7681,Q=QD=0;GH=GJ=1;WF=WF=2,,,,981.1493;R91ede8f1a607eb41,Naches River O6 L4 Drainage:2436km2 AvgFlow:2069cfs AvgPrecip:411mm AvgTemp:8C
BRPN:NCAO,North Canal near Bend OR,44.0772,-121.3019,QC=QJ=0;CH=CJ=1;WF=WF=2,,,,803.9313;Rac1c5afcd7488641,Deschutes River O5 L2 Drainage:3889km2 AvgFlow:1062cfs AvgPrecip:389mm AvgTemp:7C
BRPN:NCDO,Neil Creek mouth at Dead Indian rd nr Ashland OR,42.1856,-122.6544,Q=QD=0;GH=GJ=1;WF=WF=2,,,,794.2889;R17d9ae07a20cd041,Neil Creek O2 L3 Drainage:44km2 AvgFlow:13cfs AvgPrecip:539mm AvgTemp:11C
BRPN:NCFO,Neil Creek Above Dunn Cr Nr Ashland OR,42.1328,-122.6367,Q=QD=0;GH=GJ=1;WF=WF=2,,,,42.9069;R1b2f3dd06652ed41,Neil Creek O1 L3 Drainage:28km2 AvgFlow:10cfs AvgPrecip:756mm AvgTemp:9C
BRPN:NFBO,North Fork Little Butte Creek Canal nr Lakecreek OR,42.4274,-122.6023,QC=QJ=0;CH=CJ=1,,,,212.3896;R0681fd26f801d941,North Fork Little Butte Creek O3 L3 Drainage:144km2 AvgFlow:68cfs AvgPrecip:665mm AvgTemp:11C
BRPN:NFFO,North Fork Big Butte Creek near Butte Falls OR,42.5542,-122.5456,GH=GJ=1;WF=WF=2;Q=QD=0,,,,109.5782;Re7fbe907ecf4c641,North Fork Big Butte Creek O3 L3 Drainage:90km2 AvgFlow:52cfs AvgPrecip:957mm AvgTemp:10C
BRPN:NFLO,North Fork Little Butte Creek at 140 OR,42.4028,-122.5367,Q=QD=0;GH=GJ=1;WF=WF=2,,,,464.8025;R2fddccee4d0be141,North Fork Little Butte Creek O2 L3 Drainage:108km2 AvgFlow:78cfs AvgPrecip:742mm AvgTemp:10C
BRPN:NLCI,NEW LAVASIDE CANAL,43.2992,-112.225,QC=QJ=0;CH=CJ=1,,,,780.3759;Rf6288c3b8a89e641,Snake River O7 L2 Drainage:24227km2 AvgFlow:5914cfs AvgPrecip:291mm AvgTemp:7C
BRPN:NMCI,Minidoka Northside Canal,42.67,-113.48,QC=QJ=0;CH=CJ=1,,,,801.648;R2db28d3eb582cd41,Snake River O7 L2 Drainage:41576km2 AvgFlow:7620cfs AvgPrecip:255mm AvgTemp:9C
BRPN:NMCO,North Unit Main Canal,44.0772,-121.3019,QC=QJ=0;CH=CJ=1,,,,803.9313;Rac1c5afcd7488641,Deschutes River O5 L2 Drainage:3889km2 AvgFlow:1062cfs AvgPrecip:389mm AvgTemp:7C
BRPN:NPAO,N. Powder River bel Anthony Cr nr North Powder,45.0128,-118.0531,Q=QD=0;GH=GJ=1,,,,912.7977;Rf0a74a13250ae041, 
BRPN:NPDO,Powder River abv Thief Valley Res nr. North Powder,45.0575,-117.8408,Q=QD=0;GH=GJ=1;WF=WF=2,,,,953.6295;R46b64bdc402ed541,Powder River O5 L3 Drainage:2186km2 AvgFlow:270cfs AvgPrecip:436mm AvgTemp:8C
BRPN:NRYW,NACHES RIVER NEAR YAKIMA WA,46.6283,-120.5194,Q=QD=0;GH=GJ=1;WF=WF=2,,,,3.1932;R3f35de8fa710d441,Naches River O6 L4 Drainage:2852km2 AvgFlow:2125cfs AvgPrecip:242mm AvgTemp:10C
BRPN:NSCW,NACHES SELAH CANAL,46.7467,-120.7689,QC=QJ=0;CH=CJ=1,,,,938.1799;Rd7a3f0e108ad9d41,Naches River O6 L4 Drainage:2447km2 AvgFlow:2071cfs AvgPrecip:559mm AvgTemp:7C
BRPN:OCHO,Ochoco Creek below Ochoco Reservoir OR,44.2989,-120.7278,Q=QD=0;QC=QJ=0;GH=GJ=1;CH=CJ=1;WF=WF=2,,,,792.0413;Rdf4f8d40c09aa841,Ochoco Creek O4 L4 Drainage:752km2 AvgFlow:65cfs AvgPrecip:301mm AvgTemp:8C
BRPN:OCRO,Ochoco Cr. above Reservoir nr Prineville OR,44.3333,-120.5828,Q=QD=0;GH=GJ=1;WF=WF=2,,,,425.2015;Ra8c6ebf90fd0bc41,Ochoco Creek O4 L4 Drainage:232km2 AvgFlow:31cfs AvgPrecip:359mm AvgTemp:8C
BRPN:OSCI,OSGOOD CANAL,43.6292,-112.0792,QC=QJ=0;CH=CJ=1,,,,,
BRPN:OWY,Lake Owyhee and Owyhee River near Nyssa OR,43.6583,-117.2583,Q=QD=0;GH=GJ=1;WF=WF=2,,,,795.1562;R0c0287f95726eb41,Owyhee River O7 L3 Drainage:26436km2 AvgFlow:620cfs AvgPrecip:255mm AvgTemp:10C
BRPN:PABI,MFPI-Middle Fork Payette River near Crouch (USGS) />,44.12,-116.1,Q=QD=0,,,,846.7107;R8fc20561fdeacd41,North Fork Payette River O6 L5 Drainage:2397km2 AvgFlow:1344cfs AvgPrecip:683mm AvgTemp:9C
BRPN:PAL,Palisades Reservoir near Irwin ID,43.3347,-111.2056,GH=GJ=1,,,,934.9592;R426005d83716c341,Little Sheep Creek O2 L3 Drainage:6km2 AvgFlow:1cfs AvgPrecip:549mm AvgTemp:5C
BRPN:PALI,Snake River near Irwin ID,43.3508,-111.2183,Q=QD=0;GH=GJ=1;WF=WF=2,,,,753.7905;Rcff7b37c5d87c941,Snake River O6 L2 Drainage:13190km2 AvgFlow:6518cfs AvgPrecip:535mm AvgTemp:6C
BRPN:PARI,Boise River near Parma ID,43.7817,-116.9714,Q=QD=0;GH=GJ=1;WF=WF=2,,,,829.567;Rc74b573d9682d441,Boise River O6 L3 Drainage:10105km2 AvgFlow:1627cfs AvgPrecip:256mm AvgTemp:11C
BRPN:PARW,YAKIMA RIVER NEAR PARKER WA.,46.5061,-120.4519,Q=QD=0;GH=GJ=1;WF=WF=2,,,,359.702;R9eefa7a273d7c741,Yakima River O7 L3 Drainage:9422km2 AvgFlow:2512cfs AvgPrecip:217mm AvgTemp:11C
BRPN:PAYI,North Fork Payette River at McCall Idaho,44.9083,-116.1194,Q=QD=0;GH=GJ=1;WF=WF=2,,,,433.6985;R77be6b482155ee41,North Fork Payette River O4 L5 Drainage:374km2 AvgFlow:349cfs AvgPrecip:776mm AvgTemp:4C
BRPN:PCKY,Pacific Creek at Moran WY,43.8503,-110.5178,Q=QD=0;GH=GJ=1,,,,453.2731;R85eba9ac0b4ad341,Pacific Creek O3 L3 Drainage:429km2 AvgFlow:280cfs AvgPrecip:669mm AvgTemp:3C
BRPN:PDTO,Umatilla River at Pendleton OR,45.6722,-118.7917,Q=QD=0;GH=GJ=1;WF=WF=2,,,,7.8051;R1283584c4a80eb41,Umatilla River O5 L2 Drainage:1664km2 AvgFlow:527cfs AvgPrecip:356mm AvgTemp:11C
BRPN:PECI,PEOPLES CANAL,43.2842,-112.25,QC=QJ=0;CH=CJ=1,,,,,
BRPN:PHL,Mason Dam and Phillips Lake near Sumpter OR,44.6722,-117.9944,Q=QD=0;GH=GJ=1;WF=WF=2,,,,733.2034;R0e2df21ed220d041, O1 L4 Drainage:6km2 AvgFlow:1cfs AvgPrecip:601mm AvgTemp:6C
BRPN:PHXO,Phoenix Canal at Talent OR,42.2525,-122.7928,QC=QJ=0;CH=CJ=1,,,,499.9913;R2db29534a356ed41,Bear Creek O4 L2 Drainage:584km2 AvgFlow:118cfs AvgPrecip:525mm AvgTemp:12C
BRPN:PLCI,PALISADES CANAL NR IRWIN,43.7458,-112.1028,QC=QJ=0;CH=CJ=1,,,,475.4552;R54e3a982c0e8e941,Snake River O7 L2 Drainage:22822km2 AvgFlow:6059cfs AvgPrecip:271mm AvgTemp:6C
BRPN:PLEI,Payette River near Letha ID,43.8964,-116.6258,Q=QD=0;GH=GJ=1,,,,770.3579;R819573b71541d241,Payette River O6 L3 Drainage:7242km2 AvgFlow:3028cfs AvgPrecip:276mm AvgTemp:11C
BRPN:PNRI,PN Region USBR Hydromet Test Site-Boise ID,43.6225,-116.1933,Q=QD=0,,,,932.26;Rac1cb63e25a4ea41,Freestone Creek O2 L4 Drainage:11km2 AvgFlow:1cfs AvgPrecip:363mm AvgTemp:10C
BRPN:POCI,PORTER CANAL,43.5031,-112.0481,QC=QJ=0;CH=CJ=1,,,,959.8916;Raaf186997b3be741,North Fork Willow Creek O1 L3 Drainage:8km2 AvgFlow:0cfs AvgPrecip:298mm AvgTemp:6C
BRPN:PRD,PRIEST RAPIDS DAM & RES ON COLUMBIA RIV,46.63,-119.87,Q=QD=0,,,,212.8997;Rbe9f02173dcede41,Columbia River O8 L1 Drainage:242745km2 AvgFlow:120386cfs AvgPrecip:198mm AvgTemp:11C
BRPN:PRHO,Powder River at Hudspeth Lane near Sumpter OR,44.6861,-118.1,Q=QD=0;GH=GJ=1;WF=WF=2,,,,664.8381;Rec51b8569a23ab41,Powder River O4 L3 Drainage:219km2 AvgFlow:61cfs AvgPrecip:402mm AvgTemp:6C
BRPN:PRKI,PARKS & LEWISVILLE CANAL NR RIGBY,43.6889,-111.8661,QC=QJ=0;CH=CJ=1,,,,871.5927;Rbc74e3ebe75dc441, 
BRPN:PRLI,South Fork Payette River at Lowman ID,44.0847,-115.6028,Q=QD=0;GH=GJ=1;WF=WF=2,,,,747.2546;R2fdd74e6fd11d241,South Fork Payette River O4 L4 Drainage:1157km2 AvgFlow:872cfs AvgPrecip:692mm AvgTemp:7C
BRPN:PRPI,Payette River near Payette ID,44.0425,-116.9242,Q=QD=0;GH=GJ=1;WF=WF=2,,,,242.9649;Rfed4181e3c3ee241,Payette River O6 L3 Drainage:8537km2 AvgFlow:3069cfs AvgPrecip:266mm AvgTemp:11C
BRPN:PRRO,Powder River nr. Richland OR,44.7785,-117.2893,Q=QD=0;GH=GJ=1,,,,488.6991;R39b480e4abdee141,Powder River O5 L3 Drainage:3447km2 AvgFlow:272cfs AvgPrecip:381mm AvgTemp:9C
BRPN:PRVO,Crooked River near Prineville OR,44.1139,-120.7944,Q=QD=0;GH=GJ=1;WF=WF=2,,,,644.1709;R000078144b5cef41,Crooked River O6 L3 Drainage:6420km2 AvgFlow:331cfs AvgPrecip:261mm AvgTemp:8C
BRPN:PWDO,Powder River at Baker OR,44.7683,-117.8306,Q=QD=0;GH=GJ=1,,,,668.421;Ra01a2759ea45e441,Powder River O5 L3 Drainage:728km2 AvgFlow:142cfs AvgPrecip:319mm AvgTemp:7C
BRPN:RBDW,YAKIMA RIVER BELOW ROZA DAM,46.75,-120.4667,Q=QD=0;GH=GJ=1,,,,102.7496;R5a64fba63ea0a741,Yakima River O6 L3 Drainage:4664km2 AvgFlow:1465cfs AvgPrecip:274mm AvgTemp:9C
BRPN:RDWI,Reid Weir,43.7156,-111.8142,QC=QJ=0;CH=CJ=1,,,,823.8759;R6891155d55ded641,Snake River O6 L2 Drainage:14685km2 AvgFlow:4886cfs AvgPrecip:335mm AvgTemp:6C
BRPN:RECI,RESERVATION CANAL,43.3722,-112.15,QC=QJ=0;CH=CJ=1,,,,254.9686;Rac1c0a23101cc241,Reservation Canal 
BRPN:REXI,Henrys Fork near Rexburg ID,43.8258,-111.905,Q=QD=0;GH=GJ=1;WF=WF=2,,,,728.511;Rb6f32d0e3c22c741,Henrys Fork O6 L3 Drainage:7620km2 AvgFlow:2531cfs AvgPrecip:319mm AvgTemp:6C
BRPN:RGCI,Rigby Weir,43.6856,-111.8539,QC=QJ=0;CH=CJ=1,,,,884.2751;Rfca9c57d8a36e941, 
BRPN:RICI,RIVERSIDE CANAL,43.2636,-112.3014,QC=QJ=0;CH=CJ=1,,,,998.5951;Rc74b0728a1b7c241,Snake River O7 L2 Drainage:24454km2 AvgFlow:5810cfs AvgPrecip:276mm AvgTemp:7C
BRPN:RIM,RIMROCK RESERVOIR TIETON RIVER AND WEATHER STATION,46.6528,-121.125,Q=QD=0;GH=GJ=1,,,,554.0471;Re3a5e3e9694ee341,Tieton River O5 L5 Drainage:484km2 AvgFlow:448cfs AvgPrecip:687mm AvgTemp:6C
BRPN:RIOO,Antelope Creek above Rio Canyon near Eagle Point OR,42.3503,-122.6878,Q=QD=0;GH=GJ=1;WF=WF=2,,,,848.377;Rae4705e04fd2e841,Antelope Creek O3 L3 Drainage:81km2 AvgFlow:39cfs AvgPrecip:718mm AvgTemp:11C
BRPN:RIR,Ririe Dam and Lake near Ririe ID,43.5975,-111.7586,Q=QD=0,,,,985.7894;Rec5108e78c90c541, O1 L5 Drainage:2km2 AvgFlow:0cfs AvgPrecip:358mm AvgTemp:6C
BRPN:RIRI,Willow Creek below Ririe Dam (comp from RIR),43.62,-111.8,Q=QD=0,,,,195.0809;Rcff793d52182cd41, 
BRPN:RJPI,RAY & JOHN BROWN PUMP,43.91,-111.2844,QC=QJ=0,,,,736.5364;Rf2d2d513496adc41, O1 L5 Drainage:2km2 AvgFlow:0cfs AvgPrecip:485mm AvgTemp:4C
BRPN:ROMO,Owyhee River near Rome OR,42.8664,-117.6489,Q=QD=0;GH=GJ=1;WF=WF=2,,,,751.9434;Ra69b881d8d87ec41,Owyhee River O7 L3 Drainage:16159km2 AvgFlow:742cfs AvgPrecip:221mm AvgTemp:10C
BRPN:ROZW,ROZA CANAL AT 11.0 MILE,46.6167,-120.4833,QC=QJ=0;CH=CJ=1,,,,775.5084;Rb6f3b9feabcbea41,Yakima River O7 L3 Drainage:8366km2 AvgFlow:3805cfs AvgPrecip:246mm AvgTemp:10C
BRPN:RRPI,R. BRENT RICKS PIPELINE (TETON RIVER),43.9192,-111.5147,QC=QJ=0,,,,295.9709;R14aee71bfaa9e641,Teton River O5 L4 Drainage:2140km2 AvgFlow:924cfs AvgPrecip:445mm AvgTemp:5C
BRPN:RRVO,Rogue River Valley Canal at Bradshaw Drop,42.4136,-122.6067,QC=QJ=0;CH=CJ=1,,,,976.244;R1b2f9d5806f3df41,North Fork Little Butte Creek O3 L3 Drainage:146km2 AvgFlow:68cfs AvgPrecip:636mm AvgTemp:11C
BRPN:RSA,Reservoir A Near Lewiston Orchards ID,46.3711,-116.8575,Q=QD=0,,,,67.445;R1f85db4bfb57d441, O1 L5 Drainage:4km2 AvgFlow:0cfs AvgPrecip:523mm AvgTemp:11C
BRPN:RSCW,NEW RESERVATION CANAL,46.5194,-120.4778,QC=QJ=0;CH=CJ=1,,,,974.4011;R4c374d033faeef41, 
BRPN:RSDI,Reservation Drop,43.2444,-112.1844,QC=QJ=0;CH=CJ=1,,,,37.5307;R68918d50664fdc41,Eastern Idaho Slough 
BRPN:RXRI,REXBURG IRRIGATION CANAL NR REXBURG IDAHO,43.8364,-111.7639,QC=QJ=0;CH=CJ=1,,,,964.8477;R17d9ce663c39d841, 
BRPN:RYGO,RYGO-Rogue River at Raygold>,42.43,-122.98,Q=QD=0,,,,961.6859;Rf2d20d121028dc41, 
BRPN:RZCW,ROZA CANAL AT HEADWORKS,46.75,-120.4667,QC=QJ=0;CH=CJ=1;WF=WF=2,,,,103.2103;Rf2d221d514a4e941, 
BRPN:SALY,Salt River above Reservoir near Etna WY,43.0797,-111.0372,Q=QD=0;GH=GJ=1,,,,949.7003;R986e46433914e941,Salt River O5 L3 Drainage:1959km2 AvgFlow:643cfs AvgPrecip:515mm AvgTemp:5C
BRPN:SAWO,S. Fork Big Butte Cr abv Willow Cr nr Butte Falls OR,42.5213,-122.4863,Q=QD=0;GH=GJ=1;WF=WF=2,,,,769.9413;R9a99b94eb80cda41,Willow Creek O3 L3 Drainage:121km2 AvgFlow:73cfs AvgPrecip:865mm AvgTemp:10C
BRPN:SBCO,Mud SPrings Creek near Gateway OR,44.8019,-121.0603,Q=QD=0;GH=GJ=1;WF=WF=2,,,,14.884;R2731e85974efbb41,Mud Springs Creek O4 L4 Drainage:180km2 AvgFlow:2cfs AvgPrecip:277mm AvgTemp:10C
BRPN:SBEO,Columbia Exchange Canal near Hermiston OR,45.9119,-119.1175,QC=QJ=0;CH=CJ=1,,,,,
BRPN:SCLO,Scoggins Creek above Henry Hagg Lake OR,45.5017,-123.2517,Q=QD=0;GH=GJ=1;WF=WF=2,,,,975.7761;R250645eeb8b6e641,Scoggins Creek O2 L4 Drainage:45km2 AvgFlow:70cfs AvgPrecip:1321mm AvgTemp:11C
BRPN:SCOO,Scoggins Creek below Henry Hagg Lake Oregon,45.4694,-123.1989,Q=QD=0;GH=GJ=1;WF=WF=2,,,,671.2436;R8b6c0f3876d8e841,Scoggins Creek O3 L4 Drainage:100km2 AvgFlow:131cfs AvgPrecip:1284mm AvgTemp:11C
BRPN:SDCO,Soda Creek at Howard Prairie Delivery Canal OR,42.1997,-122.3583,Q=QD=0;GH=GJ=1,,,,259.7389;R8b6c0b8567efed41,Soda Creek O1 L3 Drainage:12km2 AvgFlow:7cfs AvgPrecip:848mm AvgTemp:7C
BRPN:SFBO,South Fork Little Butte Cr. Canal nr Lakecreek OR,42.2831,-122.4011,QC=QJ=0;CH=CJ=1,,,,,
BRPN:SFLO,South Fork Little Butte Creek at Mouth OR,42.4181,-122.6125,Q=QD=0;GH=GJ=1;WF=WF=2,,,,838.742;R5a64dbc6178be841,South Fork Little Butte Creek O3 L2 Drainage:363km2 AvgFlow:102cfs AvgPrecip:640mm AvgTemp:11C
BRPN:SFMO,South Fork Malheur nr Riverside OR,43.5542,-118.1683,Q=QD=0;GH=GJ=1,,,,43.3684;Re7fb09920d70c341,South Fork Malheur River O5 L4 Drainage:1781km2 AvgFlow:23cfs AvgPrecip:237mm AvgTemp:9C
BRPN:SHYI,Snake River near Shelley ID,43.4133,-112.1342,Q=QD=0;GH=GJ=1,,,,128.8931;R77be9b857155e441,Snake River O7 L2 Drainage:23729km2 AvgFlow:6814cfs AvgPrecip:299mm AvgTemp:7C
